"","title..1.","phone","addre"
"337","高雄仁武店","07-375-9876","高雄市仁武區中華路243號"
"338","高雄富國店","07-5561689","高雄市左營區富國路238號"
"339","高雄岡山店","07-621-4143","高雄市岡山區公園東路22-6號"
"340","高雄林園店","07-643-5353","高雄市林園區林園北路501號1F"
"341","高雄七賢店","07-211-8200","高雄市前金區七賢二路235號"
"342","高雄五福店","07-281-5668","高雄市新興區五福二路123號"
"343","高雄右昌店","07-360-0100","高雄市楠梓區德民路903號"
"344","路竹忠孝店","07-696-8753","高雄市路竹區中山路935號"
"345","高雄旗山店","07-662-7722","高雄市旗山區華中街7號"
"346","鳳山中山店","07-746-0711","高雄市鳳山區中山西路306號"
"347","鳳山五甲店","07-831-0330","高雄市鳳山區五甲二路493號"
"348","鳳山文濱店","07-777-5449","高雄市鳳山區文濱路143號"
"349","屏東內埔店","08-779-5678","屏東縣內埔鄉廣濟路317號"
"350","屏東枋寮店","08-878-8985","屏東縣枋寮鄉中興路22號"
"351","屏東中正店","08-738-1288","屏東縣屏東市中正路393號"
"352","屏東仁愛店","08-732-5688","屏東縣屏東市仁愛路88號"
"353","屏東麟洛店","08-721-7615","屏東縣屏東市民生路2-57號"
"354","屏東和平店","08-752-2888","屏東縣屏東市建國路123號"
"355","屏東恆春店","08-889-8558","屏東縣恆春鎮西門路107-2號"
"356","屏東萬丹店","08-777-0853","屏東縣萬丹鄉萬全村萬丹路一段293號"
"357","宜蘭五結店","03-950-1880","宜蘭縣五結鄉五結路三段1號"
"358","宜蘭冬山店","03-959-5385","宜蘭縣冬山鄉冬山路一段760號"
"359","宜蘭新月店","03-935-8222","宜蘭縣宜蘭市神農路二段113號"
"360","宜蘭站前店","03-935-8585","宜蘭縣宜蘭市康樂路2號"
"361","宜蘭復興店","03-935-9935","宜蘭縣宜蘭市復興路一段92號"
"362","頭城青雲店","03-977-2684","宜蘭縣頭城鎮青雲路三段128號"
"363","宜蘭礁溪店","03-987-5885","宜蘭縣礁溪鄉德陽路12號"
"364","羅東站前店","03-955-3002","宜蘭縣羅東鎮公正路78號"
"365","羅東民權店","03-954-4868","宜蘭縣羅東鎮民權路138號"
"366","花蓮中山店","03-832-3859","花蓮縣花蓮市中山路551號"
"367","花蓮中正店","03-834-3000","花蓮縣花蓮市中正路588號"
"368","花蓮和平店","03-832-5178","花蓮縣花蓮市和平路460號"
"369","台東中華店","089-360-033","台東縣臺東市中華路一段401號"
"370","暫無門市","<U+00A0>","<U+00A0>"
"371","金門民族店","082-373-168","金門縣金城鎮民族路252號"
"372","金門山外店","082-332-977","金門縣金湖鎮太湖路武德新莊5號"
"373","暫無門市","<U+00A0>","<U+00A0>"
